{
  "brand": "Inkbird",
  "series": null,
  "model": "Reptile Humidifier Fogger 4L",
  "status": "active",
  "humidifier_type": "ultrasonic_humidifier",
  "humidifier_role": "primary_grow_humidifier",
  "tank_capacity_l": 4,
  "mist_output_ml_h_min": null,
  "mist_output_ml_h_max": 300,
  "runtime_hours_max": null,
  "recommended_tent_min_cm": null,
  "recommended_tent_max_cm": null,
  "humidity_setpoint": false,
  "vpd_control": false,
  "auto_mode": false,
  "app_control": false,
  "wifi": false,
  "bluetooth": false,
  "controller_compatible": true,
  "compatible_controller_brand": "Inkbird",
  "compatible_controller_series": "IHC-200",
  "compatible_controller_models": "IHC-200, IHC-200-WIFI",
  "hose_included": true,
  "external_probe_included": false,
  "power_watts_max": null,
  "noise_db_max": 32,
  "source_url": "https://inkbird.com/products/reptile-humidifier",
  "source_type": "manufacturer",
  "source_date": "2026-06-28",
  "confidence_level": "B",
  "uvp_amount": null,
  "uvp_currency": null,
  "notes": "Ultrasonic fogger sold under the INKBIRDPLUS sub-brand. Manufacturer spec page states 300 ml/h max mist output; some retailer listings claim 380 ml/h (unverified discrepancy). 12 hours stated runtime applies at maximum mist level — minimum-output runtime unknown. Extendable hose (25.2–68.5 inches) and 2 suction cups included. No built-in humidity control; requires external outlet-switching controller for automated RH management. Officially bundled with Inkbird IHC-200 series controllers. Older variant also listed on Amazon.de under ASIN B09NNC4CXZ. Power wattage not stated on manufacturer page.",
  "include_in_default_humidity_calculator": true
}