{
  "brand": "VIVOSUN",
  "series": "AeroStream",
  "model": "AeroStream U075",
  "status": "active",
  "humidifier_type": "ultrasonic_humidifier",
  "humidifier_role": "propagation_humidifier",
  "tank_capacity_l": 0.75,
  "mist_output_ml_h_min": 30,
  "mist_output_ml_h_max": 50,
  "runtime_hours_max": 28,
  "recommended_tent_min_cm": null,
  "recommended_tent_max_cm": null,
  "humidity_setpoint": false,
  "vpd_control": false,
  "auto_mode": false,
  "app_control": "partial",
  "wifi": false,
  "bluetooth": false,
  "controller_compatible": "partial",
  "compatible_controller_brand": "VIVOSUN",
  "compatible_controller_series": "VGrow",
  "compatible_controller_models": "VGrow Smart Grow Box",
  "hose_included": null,
  "external_probe_included": false,
  "power_watts_max": 1.5,
  "noise_db_max": 28,
  "source_url": "https://vivosun.com/de-DE/vivosun-aerostream-075-usb-humidifier-p158576641050365793-v158576641050365792",
  "source_type": "manufacturer",
  "source_date": "2026-06-28",
  "confidence_level": "A",
  "uvp_amount": 36.99,
  "uvp_currency": "EUR",
  "notes": "USB Type-C powered (1.5W); 750ml tank; two modes: continuous (18h max runtime) and intermittent (28h max runtime); mist output 30–50 ml/h; designed specifically for VGrow Smart Grow Box (46x46x122cm) and Clone Grow Tent (51x36x53cm); explicitly NOT compatible with GrowHub E42A controller; app control only through VGrow system integration; no humidity setpoint, VPD control, WiFi, or Bluetooth directly; cotton wick requires periodic replacement (replace when discolored/yellowed); water level probe included as auto shut-off sensor only",
  "include_in_default_humidity_calculator": false
}
