{
  "brand": "Mars Hydro",
  "series": null,
  "model": "6L Ultrasonic Cool Mist Plant Humidifier",
  "status": "active",
  "humidifier_type": "smart_grow_humidifier",
  "humidifier_role": "primary_grow_humidifier",
  "tank_capacity_l": 6,
  "mist_output_ml_h_min": null,
  "mist_output_ml_h_max": null,
  "runtime_hours_max": 38,
  "recommended_tent_min_cm": null,
  "recommended_tent_max_cm": 150,
  "humidity_setpoint": true,
  "vpd_control": false,
  "auto_mode": true,
  "app_control": true,
  "wifi": true,
  "bluetooth": null,
  "controller_compatible": true,
  "compatible_controller_brand": "Mars Hydro",
  "compatible_controller_series": "iControl, iHub-Pro",
  "compatible_controller_models": null,
  "hose_included": true,
  "external_probe_included": true,
  "power_watts_max": null,
  "noise_db_max": 35,
  "source_url": "https://www.mars-hydro.com/6l-ultrasonic-cool-mist-plant-humidifier",
  "source_type": "manufacturer",
  "source_date": "2026-06-28",
  "confidence_level": "A",
  "uvp_amount": 79.99,
  "uvp_currency": "EUR",
  "notes": "Native RJ12 port for direct iControl and iHub-Pro integration; WiFi and MarsPro app control built-in. 4 adjustable mist levels. Humidity auto-regulation via included temp & humidity sensor. Includes 1 long + 2 short flexible hoses, 2-way nozzle, tool kit. Coverage up to 80 m². Power consumption not confirmed (manufacturer page returned 403; retailer inferences conflicted between 30 W and 50 W). Labeled '2026 New' on Amazon — newer smart model replacing the older 5L. Marshydro.eu sale price €79.99 (list €95.99, checkout €71.99).",
  "include_in_default_humidity_calculator": true
}
